************************************************************
*                                                          *
*                     W E L C O M E to                     *
*              M A D G R A P H 5 _ a M C @ N L O           *
*                                                          *
*                                                          *
*                 *                       *                *
*                   *        * *        *                  *
*                     * * * * 5 * * * *                    *
*                   *        * *        *                  *
*                 *                       *                *
*                                                          *
*         VERSION 3.5.1                 2023-07-11         *
*                                                          *
*    The MadGraph5_aMC@NLO Development Team - Find us at   *
*              http://madgraph.phys.ucl.ac.be/             *
*                            and                           *
*            http://amcatnlo.web.cern.ch/amcatnlo/         *
*                                                          *
*               Type 'help' for in-line help.              *
*           Type 'tutorial' to learn how MG5 works         *
*    Type 'tutorial aMCatNLO' to learn how aMC@NLO works   *
*    Type 'tutorial MadLoop' to learn how MadLoop works    *
*                                                          *
************************************************************
load MG5 configuration from madgraph-stable/MG5_aMC_v3_5_1/input/mg5_configuration.txt 
./HEPTools/fastjet/bin/fastjet-config does not seem to correspond to a valid fastjet-config executable (v3+). We will use fjcore instead.
 Please set the 'fastjet'variable to the full (absolute) /PATH/TO/fastjet-config (including fastjet-config).
 MG5_aMC> set fastjet /PATH/TO/fastjet-config

eMELA-config does not seem to correspond to a valid eMELA-config executable.
 Please set the 'fastjet'variable to the full (absolute) /PATH/TO/eMELA-config (including eMELA-config).
 MG5_aMC> set eMELA /PATH/TO/eMELA-config

set ninja to /vols/cms/us322/nsbi_for_dihiggs/madgraph-stable/MG5_aMC_v3_5_1/HEPTools/lib
set collier to /vols/cms/us322/nsbi_for_dihiggs/madgraph-stable/MG5_aMC_v3_5_1/HEPTools/lib
set lhapdf to /vols/cms/us322/nsbi_for_dihiggs/madgraph-stable/MG5_aMC_v3_5_1/HEPTools/lhapdf6_py3/bin/lhapdf-config
set lhapdf to /vols/cms/us322/nsbi_for_dihiggs/madgraph-stable/MG5_aMC_v3_5_1/HEPTools/lhapdf6_py3/bin/lhapdf-config
Using default text editor "vi". Set another one in ./input/mg5_configuration.txt
Using default eps viewer "evince". Set another one in ./input/mg5_configuration.txt
Using default web browser "firefox". Set another one in ./input/mg5_configuration.txt
import /vols/cms/us322/02_event_generation_14/mg_processes_2/background_0/madminer/cards/mg_commands_0.dat
The import format was not given, so we guess it as command
launch /vols/cms/us322/02_event_generation_14/mg_processes_2/background_0
************************************************************
*                                                          *
*                      W E L C O M E to                    *
*             M A D G R A P H 5 _ a M C @ N L O            *
*                      M A D E V E N T                     *
*                                                          *
*                 *                       *                *
*                   *        * *        *                  *
*                     * * * * 5 * * * *                    *
*                   *        * *        *                  *
*                 *                       *                *
*                                                          *
*         VERSION 3.5.1                 2023-07-11         *
*                                                          *
*    The MadGraph5_aMC@NLO Development Team - Find us at   *
*    https://server06.fynu.ucl.ac.be/projects/madgraph     *
*                                                          *
*               Type 'help' for in-line help.              *
*                                                          *
************************************************************
INFO: load configuration from /vols/cms/us322/02_event_generation_14/mg_processes_2/background_0/Cards/me5_configuration.txt  
INFO: load configuration from /vols/cms/us322/nsbi_for_dihiggs/madgraph-stable/MG5_aMC_v3_5_1/input/mg5_configuration.txt  
INFO: load configuration from /vols/cms/us322/02_event_generation_14/mg_processes_2/background_0/Cards/me5_configuration.txt  
Using default text editor "vi". Set another one in ./input/mg5_configuration.txt
generate_events run_01
stty: 'standard input': Inappropriate ioctl for device
The following switches determine which programs are run:
/===========================================================================\
| 1. Choose the shower/hadronization program   [1m  shower[0m = [32mPythia8[0m           |
| 2. Choose the detector simulation program    [1mdetector[0m = [31mOFF[0m               |
| 3. Choose an analysis package (plot/convert) [1manalysis[0m = [01mNot Avail.[0m        |
| 4. Decay onshell particles                   [1m madspin[0m = [31mOFF[0m               |
| 5. Add weights to events for new hypp.       [1mreweight[0m = [31mOFF[0m               |
\===========================================================================/
Either type the switch number (1 to 5) to change its setting,
Set any switch explicitly (e.g. type 'shower=OFF' at the prompt)
Type 'help' for the list of all valid option
Type '0', 'auto', 'done' or just press enter when you are done.
The following switches determine which programs are run:
/===========================================================================\
| 1. Choose the shower/hadronization program   [1m  shower[0m = [32mPythia8[0m           |
| 2. Choose the detector simulation program    [1mdetector[0m = [31mOFF[0m               |
| 3. Choose an analysis package (plot/convert) [1manalysis[0m = [01mNot Avail.[0m        |
| 4. Decay onshell particles                   [1m madspin[0m = [31mOFF[0m               |
| 5. Add weights to events for new hypp.       [1mreweight[0m = [31mOFF[0m               |
\===========================================================================/
Either type the switch number (1 to 5) to change its setting,
Set any switch explicitly (e.g. type 'shower=OFF' at the prompt)
Type 'help' for the list of all valid option
Type '0', 'auto', 'done' or just press enter when you are done.
The following switches determine which programs are run:
/===========================================================================\
| 1. Choose the shower/hadronization program   [1m  shower[0m = [32mPythia8[0m           |
| 2. Choose the detector simulation program    [1mdetector[0m = [31mOFF[0m               |
| 3. Choose an analysis package (plot/convert) [1manalysis[0m = [01mNot Avail.[0m        |
| 4. Decay onshell particles                   [1m madspin[0m = [31mOFF[0m               |
| 5. Add weights to events for new hypp.       [1mreweight[0m = [31mOFF[0m               |
\===========================================================================/
Either type the switch number (1 to 5) to change its setting,
Set any switch explicitly (e.g. type 'shower=OFF' at the prompt)
Type 'help' for the list of all valid option
Type '0', 'auto', 'done' or just press enter when you are done.
The following switches determine which programs are run:
/===========================================================================\
| 1. Choose the shower/hadronization program   [1m  shower[0m = [32mPythia8[0m           |
| 2. Choose the detector simulation program    [1mdetector[0m = [31mOFF[0m               |
| 3. Choose an analysis package (plot/convert) [1manalysis[0m = [01mNot Avail.[0m        |
| 4. Decay onshell particles                   [1m madspin[0m = [31mOFF[0m               |
| 5. Add weights to events for new hypp.       [1mreweight[0m = [31mOFF[0m               |
\===========================================================================/
Either type the switch number (1 to 5) to change its setting,
Set any switch explicitly (e.g. type 'shower=OFF' at the prompt)
Type 'help' for the list of all valid option
Type '0', 'auto', 'done' or just press enter when you are done.
The following switches determine which programs are run:
/===========================================================================\
| 1. Choose the shower/hadronization program   [1m  shower[0m = [32mPythia8[0m           |
| 2. Choose the detector simulation program    [1mdetector[0m = [31mOFF[0m               |
| 3. Choose an analysis package (plot/convert) [1manalysis[0m = [01mNot Avail.[0m        |
| 4. Decay onshell particles                   [1m madspin[0m = [31mOFF[0m               |
| 5. Add weights to events for new hypp.       [1mreweight[0m = [31mOFF[0m               |
\===========================================================================/
Either type the switch number (1 to 5) to change its setting,
Set any switch explicitly (e.g. type 'shower=OFF' at the prompt)
Type 'help' for the list of all valid option
Type '0', 'auto', 'done' or just press enter when you are done.
Do you want to edit a card (press enter to bypass editing)?
/------------------------------------------------------------\
|  [31m1[0m. param   : [32mparam_card.dat[0m                               |
|  [31m2[0m. run     : [32mrun_card.dat[0m                                 |
|  [31m3[0m. pythia8 : [32mpythia8_card.dat[0m                             |
\------------------------------------------------------------/
 you can also
   - enter the path to a valid card or banner.
   - use the 'set' command to modify a parameter directly.
     The set option works only for param_card and run_card.
     Type 'help set' for more information on this command.
   - call an external program (ASperGE/MadWidth/...).
     Type 'help' for the list of available command
 [[4m0[0m, done, 1, param, 2, run, 3, pythia8, enter path]
[1mThe answer to the previous question is not set in your input file[0m
[1mUse 0 value[0m
INFO: Update the dependent parameter of the param_card.dat 
[1;34mWARNING: update the strong coupling value (alpha_s) to the value from the pdf selected: 0.119 [0m
[1;34mWARNING: Unknow type of information in the card: dim64f2l,dim64f4l,dim6,dim62f,loop,dim64f,renor [0m
Generating 50000 events with run name run_01
survey  run_01 
INFO: compile directory 
[1;34mWARNING: information about "sminputs [1]" is missing using default value: 132.507. [0m
[1;34mWARNING: information about "yukawa [5]" is missing using default value: 4.7. [0m
[1;34mWARNING: information about "yukawa [15]" is missing using default value: 1.777. [0m
mkdir: cannot create directory ‘/.mozilla’: Permission denied
compile Source Directory
Error: no DISPLAY environment variable specified
Using random number seed offset = 21
INFO: Running Survey 
Creating Jobs
Working on SubProcesses
INFO: Compiling for process 1/2. 
INFO:     P1_gg_bbxaa  
  0%|          | 0/874 [00:00<?, ?it/s] 57%|█████▋    | 495/874 [00:00<00:00, 4742.96it/s]100%|██████████| 874/874 [00:00<00:00, 5125.44it/s]INFO: Compiling for process 2/2. 
INFO:     P1_qq_bbxaa  

  0%|          | 0/841 [00:00<?, ?it/s]100%|██████████| 841/841 [00:00<00:00, 12678.95it/s]
  0%|          | 0/841 [00:00<?, ?it/s]100%|██████████| 841/841 [00:00<00:00, 12815.20it/s]INFO:     P1_gg_bbxaa  
INFO:     P1_qq_bbxaa  
INFO:  Idle: 1,  Running: 7,  Completed: 0 [ current time: 11h58 ] 
INFO:  Idle: 0,  Running: 7,  Completed: 1 [  36.1s  ] 
INFO:  Idle: 0,  Running: 6,  Completed: 2 [  41.5s  ] 
INFO:  Idle: 0,  Running: 5,  Completed: 3 [  47.6s  ] 
INFO:  Idle: 0,  Running: 4,  Completed: 4 [  57.7s  ] 
INFO:  Idle: 0,  Running: 3,  Completed: 5 [  1m 26s  ] 
INFO:  Idle: 0,  Running: 2,  Completed: 6 [  1m 31s  ] 
INFO:  Idle: 0,  Running: 1,  Completed: 7 [  1m 37s  ] 
INFO:  Idle: 0,  Running: 0,  Completed: 8 [  1m 43s  ] 
INFO:  Idle: 0,  Running: 0,  Completed: 8 [  1m 43s  ] 
INFO: End survey 
refine 50000
Creating Jobs
INFO: Refine results to 50000 
INFO: Generating 50000.0 unweighted events. 
sum of cpu time of last step: 9m22s
INFO: Effective Luminosity 1098437453.6825538 pb^-1 
INFO: need to improve 12 channels 
- Current estimate of cross-section: 5.462304640000001e-05 +- 4.865656672128917e-07
    P1_gg_bbxaa 
    P1_qq_bbxaa 
INFO:  Idle: 51,  Running: 16,  Completed: 0 [ current time: 12h00 ] 
INFO:  Idle: 50,  Running: 16,  Completed: 1 [  39.7s  ] 
INFO:  Idle: 48,  Running: 16,  Completed: 3 [  1m 3s  ] 
INFO:  Idle: 46,  Running: 16,  Completed: 5 [  1m 13s  ] 
INFO:  Idle: 45,  Running: 16,  Completed: 6 [  1m 49s  ] 
INFO:  Idle: 44,  Running: 16,  Completed: 7 [  2m 3s  ] 
INFO:  Idle: 43,  Running: 16,  Completed: 8 [  2m 14s  ] 
INFO:  Idle: 40,  Running: 16,  Completed: 11 [  2m 18s  ] 
INFO:  Idle: 39,  Running: 16,  Completed: 12 [  3m 1s  ] 
INFO:  Idle: 38,  Running: 16,  Completed: 13 [  3m 11s  ] 
INFO:  Idle: 37,  Running: 16,  Completed: 14 [  3m 52s  ] 
INFO:  Idle: 36,  Running: 16,  Completed: 15 [  3m 55s  ] 
INFO:  Idle: 34,  Running: 16,  Completed: 17 [  4m 3s  ] 
INFO:  Idle: 33,  Running: 16,  Completed: 18 [  4m 8s  ] 
INFO:  Idle: 32,  Running: 16,  Completed: 19 [  4m 18s  ] 
INFO:  Idle: 31,  Running: 16,  Completed: 20 [  4m 22s  ] 
INFO:  Idle: 30,  Running: 16,  Completed: 21 [  4m 29s  ] 
INFO:  Idle: 29,  Running: 16,  Completed: 22 [  4m 34s  ] 
INFO:  Idle: 27,  Running: 16,  Completed: 24 [  4m 41s  ] 
INFO:  Idle: 26,  Running: 16,  Completed: 25 [  4m 47s  ] 
INFO:  Idle: 24,  Running: 16,  Completed: 27 [  4m 56s  ] 
INFO:  Idle: 22,  Running: 16,  Completed: 29 [  5m 12s  ] 
INFO:  Idle: 19,  Running: 16,  Completed: 32 [  5m 20s  ] 
INFO:  Idle: 16,  Running: 16,  Completed: 35 [  5m 25s  ] 
INFO:  Idle: 15,  Running: 16,  Completed: 36 [  5m 37s  ] 
INFO:  Idle: 14,  Running: 16,  Completed: 37 [  5m 41s  ] 
INFO:  Idle: 13,  Running: 16,  Completed: 38 [  5m 49s  ] 
INFO:  Idle: 12,  Running: 16,  Completed: 39 [  6m 18s  ] 
INFO:  Idle: 9,  Running: 16,  Completed: 42 [  6m 35s  ] 
INFO:  Idle: 8,  Running: 16,  Completed: 43 [  6m 39s  ] 
INFO:  Idle: 7,  Running: 16,  Completed: 44 [  7m 14s  ] 
INFO:  Idle: 6,  Running: 16,  Completed: 45 [  7m 17s  ] 
INFO:  Idle: 4,  Running: 16,  Completed: 47 [  7m 23s  ] 
INFO:  Idle: 2,  Running: 16,  Completed: 49 [  7m 28s  ] 
INFO:  Idle: 0,  Running: 16,  Completed: 51 [  7m 46s  ] 
INFO:  Idle: 0,  Running: 15,  Completed: 52 [  7m 55s  ] 
INFO:  Idle: 0,  Running: 14,  Completed: 53 [  8m 8s  ] 
INFO:  Idle: 0,  Running: 12,  Completed: 55 [  8m 19s  ] 
INFO:  Idle: 0,  Running: 10,  Completed: 57 [  8m 27s  ] 
INFO:  Idle: 0,  Running: 8,  Completed: 59 [  9m 30s  ] 
INFO:  Idle: 0,  Running: 7,  Completed: 60 [  9m 36s  ] 
INFO:  Idle: 0,  Running: 6,  Completed: 61 [  10m 1s  ] 
INFO:  Idle: 0,  Running: 5,  Completed: 62 [  10m 13s  ] 
INFO:  Idle: 0,  Running: 4,  Completed: 63 [  11m 26s  ] 
INFO:  Idle: 0,  Running: 3,  Completed: 64 [  13m 1s  ] 
INFO:  Idle: 0,  Running: 2,  Completed: 65 [  13m 8s  ] 
INFO:  Idle: 0,  Running: 1,  Completed: 66 [  13m 17s  ] 
INFO:  Idle: 0,  Running: 0,  Completed: 67 [  52m 3s  ] 
INFO:  Idle: 0,  Running: 0,  Completed: 67 [  52m 3s  ] 
INFO: Combining runs 
sum of cpu time of last step: 2h35m41s
INFO: finish refine 
refine 50000 --treshold=0.9
No need for second refine due to stability of cross-section
INFO: Combining Events 
  === Results Summary for run: run_01 tag: tag_1 ===

     Cross-section :   5.578e-05 +- 7.588e-08 pb
     Nb of events :  50000
 
store_events
INFO: Storing parton level results 
INFO: End Parton 
reweight -from_cards
decay_events -from_cards
INFO: [92mRunning Pythia8 [arXiv:1410.3012][0m 
Splitting .lhe event file for PY8 parallelization...
Submitting Pythia8 jobs...
Pythia8 shower jobs: 1 Idle, 15 Running, 0 Done [18 seconds]
Pythia8 shower jobs: 0 Idle, 15 Running, 1 Done [1m00s]
Pythia8 shower jobs: 0 Idle, 14 Running, 2 Done [1m00s]
Pythia8 shower jobs: 0 Idle, 13 Running, 3 Done [1m01s]
Pythia8 shower jobs: 0 Idle, 12 Running, 4 Done [1m01s]
Pythia8 shower jobs: 0 Idle, 11 Running, 5 Done [1m01s]
Pythia8 shower jobs: 0 Idle, 10 Running, 6 Done [1m02s]
Pythia8 shower jobs: 0 Idle, 9 Running, 7 Done [1m02s]
Pythia8 shower jobs: 0 Idle, 8 Running, 8 Done [1m03s]
Pythia8 shower jobs: 0 Idle, 7 Running, 9 Done [1m03s]
Pythia8 shower jobs: 0 Idle, 6 Running, 10 Done [1m03s]
Pythia8 shower jobs: 0 Idle, 5 Running, 11 Done [1m03s]
Pythia8 shower jobs: 0 Idle, 4 Running, 12 Done [1m04s]
Pythia8 shower jobs: 0 Idle, 3 Running, 13 Done [1m04s]
Pythia8 shower jobs: 0 Idle, 2 Running, 14 Done [1m04s]
Pythia8 shower jobs: 0 Idle, 1 Running, 15 Done [1m04s]
Pythia8 shower jobs: 0 Idle, 0 Running, 16 Done [1m04s]
Merging results from the split PY8 runs...
INFO: Pythia8 shower finished after 1m41s. 
INFO: No delphes_card detected, so not run Delphes 
  === Results Summary for run: run_01 tag: tag_1 ===

     Cross-section :   5.578e-05 +- 7.588e-08 pb
     Nb of events :  50000
 
INFO: storing files of previous run 
INFO: Storing Pythia8 files of previous run 
